{
  "refCatalogueSchema": "isco_base_schema.json",
  "id": "863977033828919",
  "refCatalogueSchemaRelease":"0.1.0",
  "tags": [
    "traffic data",
    "mobileye",
    "saftey"
  ],
  "owner": {
   "name": "INTEL"
  },
  "provider": {
   "name": "INTEL"
  },
  "accessMechanism": {
    "requestAccessSite": {
      "describes": "URI for getting permissions to access the device", 
      "value": "http://rbccps.org/middleware/requestAccess"
    }, 
    "subscriptionEndPoint": {
       "value": "rtmp://10.156.14.206:1935/live1/idXYZ",
       "describes": "Link to access live stream for this camera"
    },
    "accessEndPoint": {
       "value": "http://10.156.14.206/archive/idXYZ/<file.mp4>",
       "describes": "Link to access stored files for a given camera. <.../archive/idXYZ> lists all available files"
    }
  },
  "data_schema": {
    "type": "object",
    "properties": {
        "_id": {
           "type": "string",
            "units": "dimensionless",
            "permissions": "read"
        },
        "deviceCode": {
            "type": "string",
            "units": "dimensionless",
            "permissions": "read"
        },
        "location": {
             "type": "object",
             "permissions": "read",
             "properties": {
                  "wardName": {
                     "type": "string",
                     "units": "dimensionless"
                  }
             }
        }
    }
 
  }
}
